id;mpn;name;theme;subtheme;piece_count;retail_price;year_released;retirement_status;weight_kg;dimensions;notes;created_at;updated_at;release_date;retired_year;retired_date;grade_1_value;grade_2_value;grade_3_value;grade_4_value;grade_5_value;prediction_2yr;prediction_5yr;minifig_value;length_cm;width_cm;height_cm;designer;product_hook;description;call_to_action;highlights;seo_title;seo_description;user_id;brand;type;last_valued_at;upc;ean;minifigs_count;availability;age_range;color;character_ip;features;material;grade_1_value_used_low;grade_1_value_used_high;rolling_growth_1yr;rolling_growth_12m
cfcab7eb-ea18-4065-b5ff-b38683e2c975;60421-1;Robot World;City;General;986;89.99;2024;retired;;;;2026-03-07 16:03:28.928411+00;2026-03-10 01:00:14.473739+00;2024-06-01;;2025-11-28;110.59;88.47;71.88;55.3;;146.57;172.6;;;;;Aaron Newman;"Level up your collection with a brutalist neon dreamscape that makes standard city planning look like a joke.
The grid is waiting, and it doesn't suffer amateurs.";"Forget the mundane strolls through the park; this is a high-octane immersion into a neon-soaked future where the boundaries between gaming and reality cease to exist. Robot World is a masterclass in display presence, offering a sprawling, multi-level arcade complex that looks less like a toy and more like a captured fragment of a cyberpunk dream. With its sleek roller coaster tracks cutting through the structure and a pilotable mech that commands attention, this set thrives on its vibrant, chaotic energy. It captures that specific late-night arcade hum—the glow of screens, the clatter of buttons, and the thrill of the win. Whether you are staging an urban uprising or simply need a centerpiece that screams modern sophistication, this Aaron Newman design delivers a punchy, unapologetic aesthetic that makes the rest of your city look like yesterday's news.";Secure your entry to the ultimate digital playground before the grid goes dark.;"• 8 exclusive minifigures including a mecha-pilot and dedicated gamers.
• Integrated roller coaster loop circling the arcade and gaming lounge.
• Posable gaming mech designed for high-end display and interactivity.
• Designed by acclaimed LEGO designer Aaron Newman.";LEGO City 60421 Robot World | Cyberpunk Arcade & Mech Set for Collectors;Dominate the digital frontier with LEGO City Robot World 60421. Featuring 986 pieces, 8 minifigures, and an integrated roller coaster, this Aaron Newman designed masterpiece is the ultimate cyberpunk arcade for serious adult collectors. Secure this active set before its scheduled retirement in November 2025. Experience high-end design and mechanical grit in one stunning display piece.;464736d3-8ea2-45a9-9f90-95938d172080;LEGO;Set;2026-03-10 01:00:14.473739+00;673419390095;5702017587257;8;;;;;;;;;;
71ce4d20-d7f3-41fb-8ec2-01015e90eecc;sw0199;Sandtrooper;;;;;;active;;;;2026-03-07 16:01:53.944398+00;2026-03-08 01:02:01.188754+00;;;;;;;;;;;;;;;;Because patrolling a desert planet in white plastic requires a special kind of madness.;"There is a particular kind of grit required to police a backwater rock like Tatooine, and this Sandtrooper has it in spades. This isn't your pristine, parade-ready stormtrooper; this is the workhorse of the Outer Rim, detailed with the distinct orange pauldron of a squad leader who has seen too many binary suns. Whether you are hunting for droids in the Mos Eisley sprawl or simply need an officer who looks like they’ve actually done a day’s work, the sw0199 brings an essential layer of dirtbound realism to your Star Wars collection. He’s rugged, cynical, and looks exactly like the kind of professional who won’t be fooled by a simple Jedi mind trick twice. Enhance your Imperial deployment with a figure that understands the value of a good survival backpack.";Secure this desert specialist for your Imperial ranks before the dunes shift.;"• Features the iconic orange pauldron designating squad leader status.
• Authentic survival backpack and heavy sand-weathered detailing.
• Compatible with all classic Star Wars Original Trilogy displays.";LEGO Star Wars Sandtrooper Minifigure sw0199 - Imperial Squad Leader;Add the LEGO Star Wars Sandtrooper sw0199 to your collection. Featuring the rare orange pauldron and survival gear, this Imperial squad leader is essential for any Tatooine or Mos Eisley diorama. High-quality minifigure for serious adult collectors.;464736d3-8ea2-45a9-9f90-95938d172080;LEGO;Minifig;2026-03-08 01:02:01.188754+00;;;;;;;;;;;;;
6d903b51-8d9b-47c9-a68e-cbc96331ad23;75398-1;Buildable C-3PO;Star Wars;;1138;124.99;2024;active;;;;2026-03-07 16:02:45.40858+00;2026-03-10 01:00:15.19983+00;2024-08-01;;;118.49;94.79;77.02;59.25;;180.31;222;;;;;;"The galaxy’s most annoying protocol droid finally looks as expensive as he sounds.
Shut him up by putting him on a pedestal where he belongs.";"Let’s be honest: Threepio is a neurotic nightmare, but your Star Wars collection looks like a hollow shell without him. This isn’t some flimsy plaything; it’s a 1,138-piece masterclass in droid anatomy that actually commands space on a shelf. The articulated limbs and rotating head let you capture that signature brand of golden-rod anxiety, while the inclusion of the 25th-anniversary brick reminds everyone you aren't just buying toys—you’re archiving history. He’s tall, he’s shiny, and he’s probably calculating the odds of you knocking him over right now. Pair him with the R2-D2 set to finally complete the bickering duo that defined a galaxy. It’s time to stop settling for miniatures and give the protocol droid the dignified, large-scale tribute his ego demands.";Secure this golden bastard for your shelf before he finds something else to moan about.;"• Features a movable head and adjustable arms for custom posing.
• Includes a dedicated information plaque and 25th-anniversary LEGO Star Wars brick.
• Build includes a matching C-3PO minifigure to complete the display scale.
• Boasts 1,138 pieces for a detailed and rewarding adult building experience.";LEGO Star Wars C-3PO Set 75398 | 1138-Piece Adult Collectible Droid;Own the iconic LEGO Star Wars C-3PO set 75398. This 1,138-piece collectible for adults features articulated limbs, an information plaque, and a 25th-anniversary brick. Perfect for display alongside R2-D2, this detailed golden droid is a must-have for serious Star Wars collectors and LEGO enthusiasts. Add this legendary protocol droid to your collection today.;464736d3-8ea2-45a9-9f90-95938d172080;LEGO;Set;2026-03-10 01:00:15.19983+00;673419389648;5702017584508;1;;;;;;;;;;
6311f064-1f08-4744-bb58-7b3a143a12b3;lor001;Gandalf the Grey;;;;;;active;;;;2026-03-07 16:02:06.961639+00;2026-03-08 01:02:01.188754+00;;;;;;;;;;;;;;;;"A wizard is never late, but you’re pushing your luck. 
Own the icon that started the fellowship.";"Let’s be honest: your Middle-earth display is an absolute shambles without the definitive Grey Wizard holding it together. This isn’t some flashy, resurrected version in pristine white; this is Gandalf exactly as he should be—weathered, slightly grumpy, and ready to ruin a Hobbit’s afternoon with an invitation to death-defying adventure. He carries the weight of the Third Age in those plastic shoulders, sporting the iconic pointed hat and tattered cloak that define the fellowship’s guiding light. Whether he’s perched on a cart or staring down a Balrog, this minifigure commands a level of respect that your generic knights could only dream of. He arrives precisely when he means to, and right now, he means to occupy a prime spot on your shelf. Stop stalling and secure the legend.";Add the old man to your cart before he disappears into the West.;"• Features the iconic grey wizard hat and textile cloak for maximum shelf presence.
• Includes the essential wizard’s staff to keep your other minifigures in line.
• The definitive lor001 version for Lord of the Rings purists and completionists.
• Highly detailed facial printing capturing that signature Istari gravitas.";LEGO Gandalf the Grey Minifigure (lor001) - Lord of the Rings Collector's Icon;Secure the essential Gandalf the Grey (lor001) LEGO minifigure. Featuring his classic grey hat, cloak, and staff, this retired Lord of the Rings icon is a must-have for serious Middle-earth collectors. Don't settle for imitators—get the authentic Istari legend for your display today at Kuso Oishii.;464736d3-8ea2-45a9-9f90-95938d172080;LEGO;Minifig;2026-03-08 01:02:01.188754+00;;;;;;;;;;;;;
bd1df142-cf56-4b52-8676-33d2c4d80b0d;hp017;Dobby;;;;;;active;;;;2026-03-07 16:02:10.462297+00;2026-03-08 01:02:01.188754+00;;;;;;;;;;;;;;;;"Because every respectable collection needs a neurotic, self-flagellating house-elf.
A classic piece of Harry Potter history that won't punish itself.";"Stop pretending you aren’t a sucker for the most tragic house-elf in the wizarding world. This isn't the sanitised, plastic-moulded modern version; this is the classic 2002 hp017 Dobby, complete with those hauntingly vacant eyes and that distinctive, slightly chaotic charm that only early Harry Potter sets could provide. He’s small, he’s grey, and he looks like he’s about to bang his head against your bookshelf out of pure, unadulterated guilt. Whether you are recreating the frantic energy of the Chamber of Secrets or you just need a reminder that freedom is earned through laundry, this minifigure captures an era when LEGO wasn't afraid to look a little bit weird. He doesn't need a sock to be yours, just a spot in your collection.";Secure this loyal little bastard for your shelf before he vanishes.;"• The legendary original 2002 version of Malfoy’s former property.
• Features the quintessential early Harry Potter aesthetic and head mould.
• A mandatory addition for serious Wizarding World completists.";LEGO Dobby Minifigure hp017 - Classic Harry Potter Collector Item;Own the original LEGO Harry Potter Dobby minifigure (hp017). This classic 2002 edition captures the early wizarding world aesthetic. Perfect for serious collectors and Harry Potter fans looking to complete their Chamber of Secrets era sets. High-quality collector piece from Kuso Oishii.;464736d3-8ea2-45a9-9f90-95938d172080;LEGO;Minifig;2026-03-08 01:02:01.188754+00;;;;;;;;;;;;;
59c4ec5b-15c3-4fc3-9102-5ed941a662fe;40697-1;Light Up Carved Pumpkin;Creator;Seasonal;254;;2024;retired;;;;2026-03-07 16:02:42.799122+00;2026-03-10 01:00:14.614162+00;2024-01-01;;2024-01-10;23.65;18.92;15.37;11.83;;38.87;42.39;;;;;;"Because real pumpkins rot and your porch deserves better than a puddle of orange goo.
Trade the kitchen knife for a light brick and build some actual atmosphere.";"Forget those rotting, slimy husks currently decomposing on your porch. You deserve a tribute to the harvest that actually lasts. This isn't just another orange blob; it is a meticulously engineered piece of seasonal dominance that captures the jagged soul of autumn without the fruit flies. The build offers you a choice between a classic, toothy grin or a gaze that looks like it’s seen things no plastic ghost should ever witness. When the sun goes down, you click the integrated brick, and the whole thing glows with a menacing warmth that screams sophistication. It sits atop a solid grassy plinth, flanked by a floating phantom that reminds your guests exactly who runs the block. This is seasonal atmospheric perfection for the collector who demands more than just a grocery store carve-job.";Light the damn thing and claim your throne as the neighbourhood legend.;"• Features a dual-expression face build for choosing between friendly or frightening profiles.
• Includes an integrated light brick to illuminate the interior with a single press.
• Complete seasonal display featuring a green baseplate and a floating white ghost companion.";LEGO 40697 Light Up Carved Pumpkin | Seasonal Halloween Creator Set;Own the night with the LEGO Creator Light Up Carved Pumpkin 40697. This 254-piece seasonal set features a functional light brick to illuminate your choice of spooky or friendly faces. Complete with a grassy base and ghost companion, it is the ultimate sophisticated Halloween display for serious collectors. Shop this 2024 release at Kuso Oishii for premium seasonal vibes.;464736d3-8ea2-45a9-9f90-95938d172080;LEGO;Set;2026-03-10 01:00:14.614162+00;;5702017598727;0;;;;;;;;;;
61b240c2-8161-4644-9455-83721b882a89;10280-1;Flower Bouquet;Icons;Botanical Collection;756;54.99;2021;active;;;;2026-03-07 16:02:39.893465+00;2026-03-10 01:00:14.669103+00;2021-01-01;;;47.39;37.91;30.8;23.7;;70.16;;;;;;Anderson Ward Grubb;"Finally, a floral arrangement that won't die the moment you look at it.
Botanical perfection for the discerning minimalist.";"Stop wasting your hard-earned cash on organic matter that’s destined for the compost bin within a week. The LEGO Icons Flower Bouquet is the ultimate life hack for the sophisticated collector who demands aesthetic perfection without the maintenance. This isn't some primary-coloured toy; it’s a masterclass in part usage, transforming pterodactyl wings and steering wheels into delicate petals and lush foliage. Anderson Ward Grubb has designed a perennial masterpiece that stays crisp, vibrant, and incredibly sharp regardless of how little you care for it. Whether you’re looking to soften the hard edges of your display shelf or seeking a peace offering that won’t wilt before the weekend, these 756 pieces offer a textured, botanical flex that proves you’ve actually got taste. Stand them tall, adjust the stems, and let the neighbours wonder how you keep your greenery so damn pristine.";Secure your arrangement and skip the florist’s bill.;"• Features a customisable arrangement of roses, snapdragons, poppies, and asters.
• Includes innovative element re-purposing like pterodactyl wings and car windscreens.
• Includes adjustable stem lengths to fit any standard vase in your collection.
• A centerpiece of the Botanical Collection designed specifically for adult collectors.";LEGO 10280-1 Flower Bouquet | Botanical Collection Icons Set;Shop the LEGO Icons Flower Bouquet 10280-1. Part of the Botanical Collection, this 756-piece set features roses, poppies, and snapdragons. Perfect for adult collectors seeking a maintenance-free floral display with incredible detail. Designed by Anderson Ward Grubb, it’s the ultimate lifestyle build for any modern interior. Buy now at Kuso Oishii for a sharp, sophisticated build experience.;464736d3-8ea2-45a9-9f90-95938d172080;LEGO;Set;2026-03-10 01:00:14.669103+00;673419340526;5702016913767;0;;;;;;;;;;
7ddf611b-1342-4a77-ba11-bfde9853f93b;col077;Boxer;;;;;;active;;;;2026-03-07 16:02:07.791044+00;2026-03-08 01:02:01.188754+00;;;;;;;;;;;;;;;;"Toughen up your collection with the only heavyweight that matters.
Blue gloves, zero excuses, and a chin made of pure ABS plastic.";"Stop messing about with those generic brawlers and get yourself a real technician for the shelf. This Series 5 heavyweight isn't just another pugilist; he is the gold standard of the Collectable Minifigure sports world, complete with those iconic blue oversized gloves that say more than words ever could. Whether you are staging a championship bout or just need someone to look menacing in the front row of your display, the Boxer brings a level of gritty, old-school charisma that modern sets often lack. He is all business from the waist up, featuring that classic determined scowl that tells the world he hasn't even broken a sweat yet. Owning this piece is about more than just checking off a list; it is about acknowledging that sometimes, the simplest designs hit the hardest.";Add this undisputed champion to your ranks and hold the belt.;"• Features the iconic blue oversized boxing glove elements.
• Classic grimaced expression unique to the Series 5 line-up.
• A cornerstone addition for sports-themed CMF collectors.";LEGO Series 5 Boxer Minifigure col077 | Kuso Oishii Collectables;Own a piece of Collectable Minifigure history with the LEGO Series 5 Boxer (col077). This retired icon features signature blue gloves and a classic heavyweight aesthetic perfect for adult collectors. Shop Kuso Oishii for authentic LEGO CMF figures and elevate your display today.;464736d3-8ea2-45a9-9f90-95938d172080;LEGO;Minifig;2026-03-08 01:02:01.188754+00;;;;;;;;;;;;;
3f9fe82b-411d-4207-ab77-4ba49502722e;205378;Sonic the Hedgehog Game Watch;;;;;;active;;;;2026-03-07 16:03:22.224869+00;2026-03-07 20:44:02.220168+00;;;;;;;;;;;;;;;;"Because growing up is optional, but staying fast is mandatory.
If you can’t hear the ‘SEGA’ startup sound looking at this, check your pulse.";"Stop pretending you’re too mature for nostalgia when there’s a blue hedgehog involved. This isn’t a plastic trinket for the target demographic of fruit snacks; it’s a calculated strike on your childhood memories. The LEGO Sonic the Hedgehog Game Watch is for those who remember the frantic chime of losing rings and the specific stress of a drowning timer. It’s loud, it’s unapologetically 90s, and it’s arguably the most efficient way to signal to other adults that you still know exactly where the hidden chaos emeralds are located. Whether you actually use it to tell the time or simply let it sit as a trophy of your refined, slightly deranged taste in gaming history, it commands attention in any collection. Step up or stay in the slow lane.";Secure this piece of SEGA history and wear your obsession on your sleeve.;"• Official SEGA licensed Sonic the Hedgehog gear.
• Customisable watch face featuring the iconic Blue Blur.
• Robust LEGO build quality designed for collectors and fans.
• Interchangeable links for a tailored, comfortable fit.";LEGO Sonic the Hedgehog Game Watch 205378 | Kuso Oishii Collectables;Level up your wrist game with the LEGO Sonic the Hedgehog Game Watch 205378. A cult classic piece for SEGA fans and LEGO collectors, this watch blends retro gaming nostalgia with customisable building fun. Perfect for those who live life in the fast lane and demand a collection that reflects it. Shop this active set at Kuso Oishii for authentic collector-grade gear.;464736d3-8ea2-45a9-9f90-95938d172080;Sonic;Other;;;;;;;;;;;;;;
0a027ee6-63d5-4fa0-918b-44855e719612;col087;Clockwork Robot Minifig;;;;;;active;;;;2026-03-07 16:02:08.276199+00;2026-03-08 01:02:01.188754+00;;;;;;;;;;;;;;;;Wind it up and watch it judge you. The perfect blend of retro charm and mechanical indifference.;"Stop pretending your collection has soul and embrace the cold, precision-engineered charm of the Clockwork Robot. This isn’t some flimsy plastic build; it’s a masterclass in retro-futurism that demands you respect the grind. With its vintage tin-man aesthetic and that delightfully oversized wind-up key, it serves as a polite reminder that we’re all just cogs in someone else’s machine. The boxy silhouette and defiant gaze make it a standout pieces among your more organic Minifigures, offering a metallic middle finger to the mundane. It sits perfectly on a shelf, radiating a sense of clockwork autonomy that suggests it might just walk off if you stop paying attention. It’s stiff, it’s shiny, and it’s arguably more reliable than your current social circle. Secure this mechanical masterpiece and let the gears do the talking.";Add this mechanical marvel to your display before the gears seize up.;"• Features the iconic oversized wind-up key for authentic retro styling.
• Distinctive boxy head and torso design unique to the Series 6 aesthetic.
• A must-have vintage-style piece for serious Minifigure collectors.";LEGO Clockwork Robot Minifigure col087 - Retro Series 6 Collectible;Own the LEGO Clockwork Robot Minifigure (col087) from Series 6. A retro-style mechanical masterpiece featuring a vintage wind-up key and boxy aesthetic. Perfect for serious collectors who appreciate industrial design and precision-engineered charm. Add this iconic retired-style figure to your display and embrace the beauty of the machine. Shop Kuso Oishii for authentic LEGO Minifigures.;464736d3-8ea2-45a9-9f90-95938d172080;LEGO;Minifig;2026-03-08 01:02:01.188754+00;;;;;;;;;;;;;
1683983c-7de0-49c8-a700-075986969ad2;71478-1;The Never Witch's Midnight Raven;DREAMZzz;Season 2 Night of the Never Witch;1203;89.99;2024;retired;;;;2026-03-07 16:01:32.910904+00;2026-03-10 01:00:14.836813+00;2024-08-01;;2025-11-28;71.65;57.32;46.57;35.83;;94.28;108.44;;;;;;"Terrify your shelf with the ultimate feathered nightmare.
Some dreams deserve to be crushed under a giant bird's feet.";"Stop playing nice. The Never Witch's Midnight Raven is a masterclass in gothic architectural fusion, transforming from a menacing feathered titan into a nightmare cottage on stilts. This isn't just another build; it’s a high-contrast monument to the gloom of the DREAMZzz Season 2 arc. Standing as a formidable centrepiece, the set balances intricate organic curves with a haunting, structural weight. Whether you're assembling the crow-hut hybrid or the terrifying three-legged house, you're commanding a piece of retired history. The aesthetic is sheer midnight elegance—sharp, dark, and unapologetically bold. It demands a prime spot on your shelf where its massive wingspan can properly intimidate the lesser, more cheerful sets in your display. Own the shadows or get out of the way.";Add this dark masterpiece to your collection before it vanishes into the dream realm forever.;"• Features a versatile 2-in-1 build allowing transformation between a massive raven and a walking cottage.
• Includes five detailed minifigures capturing the core essence of the Night of the Never Witch.
• Boasts a substantial 1203-piece count for a complex and rewarding display-grade construction.
• Released as part of the 2024 wave and now a retired collector's item since late 2025.";Retired LEGO 71478 The Never Witch's Midnight Raven | DREAMZzz Season 2;Secure the LEGO DREAMZzz 71478 The Never Witch's Midnight Raven. A retired 1203-piece masterpiece from Season 2: Night of the Never Witch. Featuring a 2-in-1 build and 5 exclusive minifigures, this gothic raven-cottage hybrid is a must-have for serious collectors. Shop now at Kuso Oishii for authentic LEGO sets and fast shipping.;464736d3-8ea2-45a9-9f90-95938d172080;LEGO;Set;2026-03-10 01:00:14.836813+00;673419389389;5702017584249;5;;;;;;;;;;
acadf766-2c76-49ba-bafc-8ed43375f4e3;248239;Barbie Game Watch;;;;;;active;;;;2026-03-07 16:03:22.606492+00;2026-03-07 20:44:06.798004+00;;;;;;;;;;;;;;;;"Because your wrist deserves more personality and a hell of a lot more pink.
Clock-watching has never looked this damn good.";"Forget your high-spec smartwatches and biometric tracking; this is about aesthetic dominance and zero-gravity vibes. The Barbie Game Watch is a masterclass in peak 90s nostalgia, delivering that specific tactile satisfaction that modern touchscreens simply cannot replicate. It is loud, it is unapologetically plastic, and it demands attention on your wrist like a neon sign in a quiet room. Owning this isn't just about checking the time; it is about signalling that you understand the cultural gravity of the Mattel universe. It bridges the gap between toy box whimsy and refined collector irony. Whether you are reliving your childhood glory days or curating a gallery of retro-future tech, this piece serves as a vibrant, functional middle finger to boring, utilitarian horology. It is time to embrace the pink.";Secure this piece of pink-hued digital history before someone else beats you to it.;"• Official Mattel licensed Barbie merchandise.
• Classic 90s-era digital game watch functionality.
• Bold signature Barbie aesthetic for maximalist collectors.
• A rare crossover of wearable tech and toy history.";Barbie Game Watch 248239 | Retro Digital Collector's Piece | Kuso Oishii;Shop the Barbie Game Watch (248239) at Kuso Oishii. This iconic piece of retro digital tech combines 90s nostalgia with bold Mattel style. Perfect for collectors who appreciate irony, aesthetic dominance, and pink-hued history. Secure this active set while stocks last and add a functional piece of plastic perfection to your curated collection today.;464736d3-8ea2-45a9-9f90-95938d172080;Barbie;Other;;;;;;;;;;;;;;
