id;mpn;name;theme;subtheme;piece_count;retail_price;year_released;retirement_status;weight_kg;dimensions;notes;created_at;updated_at;release_date;retired_year;retired_date;grade_1_value;grade_2_value;grade_3_value;grade_4_value;grade_5_value;prediction_2yr;prediction_5yr;minifig_value;length_cm;width_cm;height_cm;designer;product_hook;description;call_to_action;highlights;seo_title;seo_description;user_id;brand;type;last_valued_at;upc;ean;minifigs_count;availability;age_range;color;character_ip;features;material;grade_1_value_used_low;grade_1_value_used_high;rolling_growth_1yr;rolling_growth_12m
148fb880-4348-40a6-8cf9-890693ef5004;lor002;Frodo Baggins (lor002);;;;;;active;;;;2026-03-07 19:57:30.092188+00;2026-03-08 09:20:20.981622+00;;;;;;;;;;;;;;;;"The smallest person can indeed change the course of your shelf space. 
Don’t be the fool who misses the Ring-bearer.";Stop pretending your Middle-earth display is complete without the one hobbit who actually bothered to finish the job. This lor002 Frodo Baggins represents the Shire’s most reluctant hero in his quintessential early-journey attire, capturing that fleeting moment before the Ring’s weight and Gollum’s constant breathing down his neck ruined his posture. It is a masterclass in scale and character design, providing the gravitational centre for any Fellowship gathering. Whether he is standing atop your desk or tucked away in a high-end display case, this minifigure carries an atmospheric weight that belies his diminutive stature. You know the story, you know the stakes, and you know damn well that leaving a Frodo-sized hole in your collection is a rookie mistake you will regret once the stock dries up.;Add this burden to your collection today.;"• Official LEGO Lord of the Rings lor002 minifigure
• Features the iconic sand blue short legs and vest combo
• Essential protagonist for any Fellowship of the Ring display
• Highly sought-after collector piece from the original 2012 wave";LEGO Frodo Baggins Minifigure lor002 - Lord of the Rings Collector Piece;Secure the essential Frodo Baggins lor002 LEGO minifigure for your Middle-earth collection. Featuring his classic Shire waistcoat and sand blue short legs, this authentic Lord of the Rings character is a must-have for serious collectors and Tolkien fans. Shop Kuso Oishii for high-end LEGO minifigures and elite building sets.;464736d3-8ea2-45a9-9f90-95938d172080;;;;;;;;;;;;;;;;
eaa200e2-07e7-49a4-ae22-a74fe3ec6799;col148;Warrior Woman (col148);;;;;;active;;;;2026-03-07 19:57:38.372163+00;2026-03-08 09:21:03.471382+00;;;;;;;;;;;;;;;;She isn’t here to play nice. She’s here to conquer your shelf and look damn good doing it.;"Forget the damsel routine; this is the steel-eyed powerhouse your shelf has been missing. The Warrior Woman is a masterclass in ancient intimidation, captured with the kind of precision that makes other minifigures look like they belong in a preschool toy box. Clad in intricate Athenian-inspired armour and wielding a shield that suggests she’s seen more combat than your entire collection combined, she commands the room without saying a word. Whether she’s leading a phalanx or standing guard over your rarest sets, her presence is undeniable. This isn't just another Series 10 filler; it’s a tribute to the uncompromising spirit of the ancients. She doesn’t ask for space on your display—she takes it by force. If your collection feels a bit too polite lately, let her fix that for you.";Add some bite to your lineup today.;"• Features highly detailed Grecian-style print work and armour.
• Includes her signature spear and custom-moulded shield.
• Part of the iconic Collectible Minifigures Series 10 lineup.
• Perfect for historical dioramas or high-end display cases.";LEGO Warrior Woman col148 Minifigure - Series 10 | Kuso Oishii;Own the powerful Warrior Woman (col148) from LEGO Minifigures Series 10. A highly detailed, battle-ready figure for serious collectors. Shop now at Kuso Oishii for authentic LEGO.;464736d3-8ea2-45a9-9f90-95938d172080;Minifig;;;;;;;;;;;;;;;
e7d72b77-b0d2-4e81-bef6-20fcf227f2f4;71047-3;Dungeons & Dragons Tiefling Sorcerer (71047-3.1);;;;;;active;;;;2026-03-07 19:57:39.369116+00;2026-03-08 09:21:07.218537+00;;;;;;;;;;;;;;;;Because nothing says 'I control your fate' like a purple-skinned sorcerer with a pet dragon.;"Stop playing the generic hero and embrace the infernal elegance of the Tiefling Sorcerer. This isn't just another plastic bystander; it is a masterclass in tabletop aesthetics, boasting some of the most intricate printing to hit the CMF line. The purple-skinned charisma is palpable, featuring those iconic horns and a dual-molded aesthetic that demands more than just a shelf—it deserves a diorama. Whether you are assembling a full party of misfits or just need a caster who looks like they’ve actually survived a layer of the Nine Hells, this sorcerer brings a dangerous level of sophistication to your collection. The translucent magic effects and the baby red dragon accessory aren't just details; they are a statement of intent. Don't let your display settle for mundane when you can command the arcane.";Claim your seat at the dungeon table today.;"• Features a stunning custom-moulded headpiece with integrated horns and purple skin tones.
• Includes a unique baby red dragon companion and translucent magic power elements.
• Equipped with highly detailed torso and leg printing exclusive to the Dungeons & Dragons series.
• Comes with a themed display base and original series character accessories.";LEGO Dungeons & Dragons Tiefling Sorcerer Minifigure - 71047-3;Shop the LEGO Dungeons & Dragons Tiefling Sorcerer (71047-3). A premium CMF character featuring exclusive dual-moulded horns, a baby red dragon, and detailed arcane printing. Perfect for D&D fans and collectors. Order now from Kuso Oishii.;464736d3-8ea2-45a9-9f90-95938d172080;Set;;;;;;;;;;;;;;;
31ff3345-98c6-4827-80b9-cd9e55a56b1a;idea001;Marty McFly (idea001);;;;;;active;;;;2026-03-07 19:57:43.674187+00;2026-03-08 09:21:20.5414+00;;;;;;;;;;;;;;;;Great Scott. The original timeline-jumper has arrived to fix your lackluster display.;"Stop pretending your collection is complete without the figure that kickstarted the entire Ideas revolution. Marty McFly isn’t just a minifigure; he’s a high-stakes bet on nostalgia that actually paid off. This version of the iconic time traveller brings that 1985 energy to your display shelf with a look that screams ""I just set a clock tower on fire."" Whether he’s perched on your desk or tucked into a custom MOC, Marty carries the weight of a franchise that redefined sci-fi cinema. He represents the moment LEGO realised they could tap into our collective childhood obsession with 88mph and flux capacitors. You don’t need roads where you’re going, but you definitely need this kid in your lineup. He’s the ultimate conversation starter for those who know their history.";Secure the icon before the timeline shifts.;"• The debut minifigure from the LEGO Ideas line (idea001)
• Iconic 1985 Marty McFly aesthetic with signature red puffer vest
• Essential centerpiece for any Back to the Future collection
• A rare piece of history from the fan-designed platform's origins";LEGO Marty McFly Minifigure (idea001) - Back to the Future Icon;Own a piece of LEGO history with the original Marty McFly (idea001) minifigure from the Back to the Future Ideas set. This iconic figure features Marty in his classic 1985 red puffer vest. A must-have for movie buffs and serious collectors looking for the figure that launched the Ideas theme. Shop Kuso Oishii for authentic collector-grade LEGO minifigures and rare finds.;464736d3-8ea2-45a9-9f90-95938d172080;;;;;;;;;;;;;;;;
79eb13c4-08fd-4fb2-b722-d2b34ff235ea;B07L68RQCX;Casio FX-85GTX Scientific Calculator - Black;;;;;;active;;;;2026-03-07 19:57:21.340313+00;2026-03-08 09:18:40.280623+00;;;;;;;;;;;;;;;;"Because guessing is for losers and your phone is a distraction.
Precision has a signature look, and it’s matte black Casio.";"Stop pretending your phone's calculator app is enough when you are staring down a complex spreadsheet or a late-night engineering crisis. The Casio FX-85GTX is the industry standard for a reason; it is a tactical instrument for those who demand precision over touchscreen gimmicks. With its sleek black casing and high-resolution Natural Textbook Display, this isn't just a tool for the classroom—it is a reliability statement for your workspace. It handles your fractions, logarithms, and statistical regressions without breaking a sweat or asking for a software update. Whether you are balancing the books or calculating the trajectory of your next big move, this bit of kit feels substantial in the hand and looks sharp on the desk. Real pros don't guess; they calculate with intent.";Upgrade your desktop arsenal today.;"• High-resolution Natural Textbook Display for crystal-clear clarity.
• Classic black finish that fits any professional or academic setup.
• Extensive functionality covering basic maths to advanced statistics.
• Solar powered with battery backup for uninterrupted performance.";Casio FX-85GTX Scientific Calculator - Black | Kuso Oishii;Own the Casio FX-85GTX Scientific Calculator in Black. The ultimate reliable tool for students and professionals. High-resolution display and legendary Casio durability. Buy now at Kuso Oishii.;464736d3-8ea2-45a9-9f90-95938d172080;;;;;;;;;;;;;;;;
b7627569-31d9-43b0-9d60-153f327de0e3;sw0585;Stormtrooper;;;;;;active;;;;2026-03-07 16:02:11.356148+00;2026-03-08 01:02:01.188754+00;;;;;;;;;;;;;;;;"The Empire doesn't care about your feelings, but it does care about numbers. 
Line up or get out of the way.";"There is a particular kind of power in the uniform, and sw0585 captures that clinical, imperial menace with terrifying precision. This isn't just another faceless grunt; it's the backbone of your shelf's military might, featuring the refined helmet detailing and printed legs that separate a modern collector’s display from a box of childhood scraps. Whether you are staging a tactical takeover of the living room or lining them up in intimidating rows of white and black, this Stormtrooper brings the cold, calculated discipline of the Galactic Empire to your collection. It is the definitive grunt, the essential silhouette, and the only figure that looks better the more of them you own. Stop pretending your diorama is complete without a fresh squad of these bucket-heads standing at attention.";Add this loyal foot soldier to your ranks before the Empire finds your lack of faith disturbing.;"• Features the iconic Star Wars Rebels era helmet design pattern.
• Detailed leg printing for a superior, tactical aesthetic compared to earlier variants.
• The essential army-builder for any serious Imperial remnant or Galactic Empire display.
• Minifig ID sw0585 ensures period-accurate accuracy for your Rebels-themed builds.";LEGO Star Wars Stormtrooper Minifigure sw0585 | Imperial Army Builder;Secure the essential LEGO Star Wars Stormtrooper minifigure sw0585. Featuring detailed leg printing and the iconic Rebels-style helmet, this Imperial soldier is the perfect addition for army builders and serious collectors looking to bolster their Galactic Empire ranks. High-quality, authentic LEGO parts for ultimate display presence.;464736d3-8ea2-45a9-9f90-95938d172080;LEGO;Minifig;2026-03-08 01:02:01.188754+00;;;;;;;;;;;;;
3a9a682f-fb11-475a-a1f3-67e7ecfa12cb;10281-1;Bonsai Tree;Icons;Botanical Collection;878;44.99;2021;active;;;;2026-03-07 16:02:35.310771+00;2026-03-10 01:00:12.817997+00;2021-01-01;;;39.49;31.59;25.67;19.75;;58.47;65;;;;;;"The ultimate flex for the sophisticated minimalist who kills every plant they touch.
Finally, a hobby that looks expensive but won't die while you're on holiday.";"Traditional gardening is for people with too much time and a tolerance for soil under their fingernails. You deserve the aesthetic payoff of a centuries-old tradition without the risk of killing it through neglect. This Icons masterpiece is a masterclass in versatility, allowing you to swap serene evergreen foliage for a vibrant explosion of pink cherry blossoms that, upon closer inspection, reveals a cheeky swarm of tiny frogs. It is a sophisticated desk companion that demands respect rather than water. As part of the Botanical Collection, it captures that elusive intersection of organic beauty and geometric precision. At this level of craftsmanship, you aren't just building a tree; you are curated a vibe that says you have your life together, even if the rest of your office is a disaster.";Secure this piece of botanical perfection before it retires for good.;"• Includes interchangeable sets of green leaves and pink cherry blossom foliage.
• Features a buildable rectangular pot and a slatted wood-effect stand for museum-quality display.
• Contains hidden 'frog' elements within the blossoms for a signature design twist.
• A cornerstone of the Botanical Collection designed specifically for adult collectors.";LEGO Icons Botanical Collection: Bonsai Tree Set 10281 | Retiring Soon;Own the LEGO Icons Bonsai Tree 10281 from the Botanical Collection. Featuring 878 pieces and interchangeable seasonal foliage, this retiring set is the perfect display piece for adult collectors. Shop now before this Icons classic is gone forever.;464736d3-8ea2-45a9-9f90-95938d172080;LEGO;Set;2026-03-10 01:00:12.817997+00;673419340533;5702016914177;0;;;;;;;;;;
4fe9f566-70e8-4679-a18e-739801ccc487;col117;Football Player (col117);;;;;;active;;;;2026-03-07 19:57:29.498353+00;2026-03-08 09:20:15.479239+00;;;;;;;;;;;;;;;;"Trophy cabinets are for winners.
Put some championship pedigree on your shelf.";"Stop pretending your shelf has enough athletic prowess. The Football Player (col117) isn't just another plastic body; he’s the clutch player your collection desperately needs to clinch the title. Dressed in a classic kit that screams tradition, this minifigure brings that distinct match-day tension to your display. Whether he’s lining up for a decisive free kick or just standing there looking superior to your more sedentary figures, his presence is undeniable. This is for the collector who understands that sport is theatre and every stadium needs its hero. He doesn’t care about your tactics; he just cares about the back of the net. Stop overthinking the formation and put a proven winner in your starting eleven before he’s subbed off for good.";Secure this midfield maestro before the final whistle.;"• Features the iconic col117 minifigure design
• Classic football kit with authentic sporting aesthetic
• Perfect addition to any sporting or stadium-themed display";LEGO Football Player Minifigure col117 - Sports Series | Kuso Oishii;Secure the LEGO Football Player (col117) for your collection. This iconic sports minifigure brings match-day energy and championship style to any display. High-quality collector piece for football enthusiasts and LEGO fans alike. Shop the col117 Football Player at Kuso Oishii for authentic minifigures and elite collector service.;464736d3-8ea2-45a9-9f90-95938d172080;;;;;;;;;;;;;;;;
59ed2d0e-d709-4dad-b4f2-f7faa34fe639;col155;Pagliacci Sad Clown (col155);;;;;;active;;;;2026-03-07 19:57:47.094568+00;2026-03-08 09:21:33.696608+00;;;;;;;;;;;;;;;;"Life is a joke and you’re the punchline.
Display the only clown that actually understands you.";"Stop pretending your collection has depth when it lacks the crushing emotional weight of a thousand silent tears. The Pagliacci Sad Clown isn't just another minifigure; he is a cautionary tale in plastic, dressed in monochrome misery and holding the very instrument of his sonic despair. From the meticulously painted ruff to the teardrop that speaks volumes of a life spent performing for those who will never truly know him, this figure demands a prominent spot on your display. He represents the duality of the performer, the silent scream behind the makeup, and the absolute peak of Minifigures Series 10 character design. If his existential dread doesn't move you, his rarity surely will. Secure the most depressed man in the bin before he fades into total obscurity.";Add this tragic masterpiece to your shelf.;"• Features the iconic melancholic teardrop printing.
• Includes the distinct 1x2 printed accordion tile.
• Classic monochrome aesthetic from Series 10.
• A hallmark piece for serious CMF collectors.";LEGO Pagliacci Sad Clown col155 - Series 10 Minifigure | Kuso Oishii;Shop the LEGO Pagliacci Sad Clown (col155) from Minifigures Series 10. Featuring a unique accordion and teardrop detail, this iconic CMF character adds a touch of classic tragedy to any collection. Get this retired-style legend while stocks last.;464736d3-8ea2-45a9-9f90-95938d172080;;;;;;;;;;;;;;;;
e7914d42-6dfa-4eab-92e9-58dd3dfbabd0;cty0339;Girl;;;;;;active;;;;2026-03-07 16:02:14.551371+00;2026-03-08 01:02:01.188754+00;;;;;;;;;;;;;;;;"Because your meticulously planned metropolis looks like a ghost town without her.
Stop building empty streets and start building a society.";"Every city needs a bit of personality, and this young lady is here to provide it with a smile that suggests she knows exactly where the bodies are buried—or at least where the best coffee is. Featuring the iconic classic pigtails and a vibrant striped top, cty0339 is the quintessential urbanite designed to breathe life into your modular street scenes. She isn't just a piece of plastic; she is the witness to your City’s daily chaos, standing as a perfect example of why the simplest figures often carry the most weight in a high-end display. Whether she’s crossing the street or judging your architectural choices from the pavement, her presence adds a necessary layer of authenticity to your collection. Stop settling for empty streets and give your builds the population they deserve.";Add this essential civilian to your urban sprawl today.;"• Features the iconic classic pigtails in black for a timeless aesthetic.
• Vibrant blue and white striped torso adds a pop of colour to any street scene.
• Essential civilian character for LEGO City and Modular Building collectors.
• Versatile design that fits perfectly into dioramas and photography projects.";LEGO City Girl Minifigure (cty0339) - Pigtails & Stripes | Kuso Oishii;Enhance your LEGO City collection with the cty0339 Girl minifigure. Featuring classic pigtails and a striped blue shirt, this essential civilian is perfect for modular building displays. Shop authentic LEGO City minifigures at Kuso Oishii for collectors who demand the best in urban detail. Active retirement status—get yours while stocks last.;464736d3-8ea2-45a9-9f90-95938d172080;LEGO;Minifig;2026-03-08 01:02:01.188754+00;;;;;;;;;;;;;
dc535871-2ee7-4887-b700-4217130fb02b;8718696176528;Philips Hue Infuse White and Colour Ambiance Smart Ceiling Light [Large - Black];;;;;;active;;;;2026-03-07 19:57:48.254763+00;2026-03-08 09:21:38.132402+00;;;;;;;;;;;;;;;;"God said ""Let there be light,"" but he didn't say it had to be this fucking glorious.";"Stop living in a beige wasteland of clinical overhead glare. The Philips Hue Infuse isn't just a ceiling light; it is a declaration of intent for your living space. This large, black-framed powerhouse projects a sophisticated halo effect against your ceiling while simultaneously drenching your room in sixteen million colours or the perfect shade of crisp white work light. Whether you are setting the mood for a late-night session or need a brutal brightness to find that dropped piece of plastic on the carpet, the Infuse delivers with surgical precision. It is sleek, understated, and commands the room without trying too hard. Integrate it into your ecosystem and finally take control of the one thing that actually dictates the vibe of your collection: the light.";Master your atmosphere today.;"• Massive 16 million colour spectrum for total environmental control.
• Sophisticated black finish with dual-zone halo lighting effect.
• Seamless integration with the global Philips Hue smart ecosystem.
• Large-format design engineered for maximum room coverage.";Philips Hue Infuse Large Smart Ceiling Light - Black | Kuso Oishii;Upgrade your space with the Philips Hue Infuse Large Smart Ceiling Light in Black. Featuring White and Colour Ambiance, this premium smart light offers 16 million colours, halo lighting effects, and seamless app control to transform your home atmosphere instantly. High-end lighting for serious collectors.;464736d3-8ea2-45a9-9f90-95938d172080;;;;;;;;;;;;;;;;
ac959f59-6e67-4c32-adb6-e5f45e827003;col072;Lumberjack;Light;;;;;active;;;;2026-03-07 16:02:03.844668+00;2026-03-10 01:02:26.242284+00;;;;;;;;;;;;;;;;"Tougher than a frozen pine and significantly more dangerous with an axe.
The flannel-clad icon of Series 5 has arrived.";"There is something deeply satisfying about a man who knows his way around a felling axe. The Lumberjack (col072) isn't here to discuss your feelings or your carbon footprint; he is here to drop timber and look damn good doing it. Clad in the kind of flannel that suggests he spends his weekends wrestling bears and winning, this CMF Series 5 legend brings a rugged, no-nonsense energy to your display shelf. Whether you are building an expansive forest scene or just need someone to remind your other minifigures that they are soft, this guy delivers. He’s the personification of cold mornings, sharp steel, and total silence. Adding him to your collection isn't just a choice; it is an admission that you appreciate the quiet power of a job well done.";Grab this bearded bastard before he heads back to the treeline.;"• Features the iconic red flannel pattern and classic beanie combo.
• Equipped with a sturdy felling axe accessory for maximum utility.
• Essential character from the high-demand Collectible Minifigures Series 5.
• Perfect for wilderness dioramas or toughening up a city layout.";LEGO Lumberjack Series 5 Minifigure col072 | Kuso Oishii;Shop the LEGO Series 5 Lumberjack (col072) at Kuso Oishii. This iconic collectible minifigure features a classic red flannel shirt, beanie, and felling axe. Perfect for adult collectors and wilderness diorama builds. Add a touch of rugged masculinity to your LEGO collection with this retired Series 5 standout. Authentic LEGO parts and sharp printing guaranteed. Get yours today.;464736d3-8ea2-45a9-9f90-95938d172080;LEGO;Minifig;2026-03-10 01:02:26.242284+00;;;0;;;;;;;;;;
b1939d96-4a24-45e4-abe9-beb2c2ad5451;sim016;Ralph Wiggum (sim016);;;;;;active;;;;2026-03-07 19:57:50.172253+00;2026-03-08 09:21:45.769721+00;;;;;;;;;;;;;;;;"He’s a legend, he’s a liability, and his breath smells like cat food.
Meet Ralph Wiggum—the crown jewel of Springfield’s special education department.";"He’s the boy who once tasted a crayon and saw the face of god. Ralph Wiggum isn’t just a minifigure; he’s a philosophical boundary-pusher in a toddler’s body. This sim016 iteration captures that hauntingly blank stare and the Valentine’s card-clutching desperation that reminds you why The Simpsons Movie was a formative experience. He’s the physical manifestation of ""I'm in danger,"" and quite frankly, your display shelf is looking a little too competent without him. Adding Ralph isn’t just about completing a set; it’s about acknowledging the chaotic, glue-eating energy that lives inside us all. He’s small, he’s weird, and he’s probably going to try to eat the other minifigures. Build your Springfield roster with the only character who can make a simple sentence feel like a cry for help.";Add Springfield’s finest to your collection.;"• Features the iconic 'I Choo-Choo-Choose You' card accessory.
• Authentic short-leg design for that classic Ralph stature.
• Essential character for any Simpsons Series 1 collector.
• High-detail printing captures his vacant, lovable expression.";LEGO Ralph Wiggum Minifigure sim016 - The Simpsons Series 1;Own the legendary LEGO Ralph Wiggum sim016 minifigure from The Simpsons Series 1. Features the iconic Valentine's card and classic short legs. Perfect for serious collectors.;464736d3-8ea2-45a9-9f90-95938d172080;;;;;;;;;;;;;;;;
